id,name,brand,year,price,seats,transmission,fuelType,image,description,features,engine,horsepower,torque,fuelConsumption,dimensions,weight
6487245,LandRover Range Rover Autobiography 5.0 2014,LandRover,2014,2290000000,4,Số tự động,Xăng,https://s.bonbanh.com/uploads/users/786547/car/6487245/m_1760944999.179.jpg,Nhập Team Nguyên Xe Mộc LandRover Range Rover Autobiography 5.0 V8 Supercharged sản xuất 2014 ĐEN//NÂU xe chạy được 8vạn6km cực mới nội thất mới tinh .xe đẹp không lỗi về rửa qua nước lã là đi Khách. ACE TỰ TIN CỌC ONLINE . Bán kèm biển định danh : 30M-967.88 Giá : 120tr bao định danh a Hỗ trợ trả g...,"Lốp mới, Kết nối Bluetooth",Xăng 5.0 L,439,544 Nm,13.0L/100km,4600 x 1800 x 1450 mm,1444 kg
6284247,LandRover Range Rover Velar R-Dynamic 2.0 2018,LandRover,2018,2179000000,5,Số tự động,Xăng,https://s.bonbanh.com/uploads/users/482242/car/6284247/m_1752638225.177.jpg,"AUTO CHỐT HÀ NỘI MỞ BÁN Nhập Team Nguyên Xe Mộc LandRover Range Rover Velar R-Dynamic 2.0 sản xuất 2018 Đỏ//Đen xe chạy 6vạn3km zin cực mới Đẹp từ trong ra ngoài ACE TỰ TIN CỌC ONLINE . Full Option : Cửa sổ trời toàn cảnh Panorama , Hệ thống âm thanh Meridian cao cấp Màn hình Touch Pro Duo + cụm đồn...","Lốp mới, Cửa sổ trời, Màn hình Android",Xăng 2.0 L,175,228 Nm,7.6L/100km,4600 x 1800 x 1450 mm,1466 kg
6184385,LandRover Range Rover Autobiography 5.0 2014,LandRover,2014,2289000000,4,Số tự động,Xăng,https://s.bonbanh.com/uploads/users/482242/car/6184385/m_1757494538.755.jpg,"AUTO CHỐT HÀ NỘI MỞ BÁN Nhập Team Nguyên Xe Mộc LandRover Range Rover Autobiography 5.0 sản xuất 2014 ĐEN//NÂU xe chạy được 8 vạn 6km cực mới nội thất mới tinh .xe đẹp không lỗi về rửa qua nước lã là đi Khách. ACE TỰ TIN CỌC ONLINE . Hỗ trợ trả góp lên tới 70% giá trị xe, khách bị nợ sấu hỗ trợ trả ...","Kết nối Bluetooth, Màn hình Android",Xăng 5.0 L,445,537 Nm,10.4L/100km,4600 x 1800 x 1450 mm,1427 kg
6469211,LandRover Range Rover Autobiography LWB P460e 3.0 I6 AWD PHEV 2025,LandRover,2025,14590000000,5,Số tự động,Hybrid,https://s.bonbanh.com/uploads/users/122163/car/6469211/m_1759939752.454.jpg,"Cả thị trường chỉ có 1 chiếc duy nhất. Range Rover Autobiography PHEV trục cơ sở dài chính thức tìm chủ mới sau 2.200km Ngoại thất đen Santorini, nội thất nâu Caraway Odo: 2.000km như xe mới Sản xuất 2025, nhập Anh. Còn bảo hành hãng Nói tới dòng Range Rover mà còn là Autobio thì là đỉnh cao của san...","Kết nối Bluetooth, Dán phim cách nhiệt",Hybrid 3.0 L,402,579 Nm,11.3L/100km,4600 x 1800 x 1450 mm,1345 kg
6386030,LandRover Range Rover Velar R-Dynamic SE 2.0 2019,LandRover,2019,2290000000,5,Số tự động,Xăng,https://s.bonbanh.com/uploads/users/482242/car/6386030/m_1757131212.373.jpg,"AUTO CHỐT HÀ NỘI MỞ BÁN Nhập Team Nguyên Xe Mộc LandRover Range Rover Velar R-Dynamic SE 2.0 sx 2019 xe chạy 8vạnkm Full option sấy sưởi, cửa nóc, màn hình gối,......xe mới đét,xe cực kì đẹp không lỗi nhỏ . Hỗ trợ trả góp lên tới 70% giá trị xe, khách bị nợ sấu hỗ trợ trả góp 50% giá trị xe. ACE kết...","Kết nối Bluetooth, Dán phim cách nhiệt",Xăng 2.0 L,173,205 Nm,7.8L/100km,4600 x 1800 x 1450 mm,1389 kg
6109979,LandRover Range Rover HSE LWB 5.0 2013,LandRover,2013,1689000000,5,Số tự động,Xăng,https://s.bonbanh.com/uploads/users/482242/car/6109979/m_1761296632.285.jpg,AUTO CHỐT HÀ NỘI mới về chào bán ngay Nhập team nguyên xe Mộc LandRover Range Rover HSE LWB 5.0 sản xuất 2013 Đen//Kem xe chạy 10vạnkm cực mới. ACE TỰ TIN CỌC ONLINE . ACE kết nối có khách cùng bán. Thank’s! Ở đâu giá tốt CHỐT đây sẽ tốt hơn. Giá rất linh động miễn sao vào việc trôi được xe.,"Kết nối Bluetooth, Màn hình Android",Xăng 5.0 L,415,506 Nm,10.1L/100km,4600 x 1800 x 1450 mm,1500 kg
3082772,LandRover Range Rover Sport HSE 3.0 I6 2021,LandRover,2021,7055000000,7,Số tự động,Xăng,https://s.bonbanh.com/uploads/users/487326/car/3082772/m_1582189092.jpg,"Land Rover Range Rover Sport HSE 3.0 360PS 2021 7 chỗ - Điểm nhấn nổi bật nhất là mặt ca lăng có thiết kế mới, rộng hơn, nổi bật hơn với cắc mắt lưới hình lục giác bóng bẩy, ác cụm đèn chiếu sáng LED sắc sảo với điểm nhấn là 2 dải LED định vị hình chữ nhật tuyệt đẹp. - Xe trang bị màn hình cảm ứng k...","Lốp mới, Camera 360, Màn hình Android",Xăng 3.0 L,248,302 Nm,11.1L/100km,4600 x 1800 x 1450 mm,1327 kg
6543519,LandRover Range Rover Autobiography LWB 5.0 2018,LandRover,2018,5888000000,4,Số tự động,Xăng,https://s.bonbanh.com/uploads/users/371796/car/6543519/m_1764047562.495.jpg,Siêu hiếm còn sót lại trên thị trường Range Rover Autobiography LWB 5.0 sản xuất 2018 xe tên cá nhân 1 chủ từ mới chạy đúng 5v km. Hàng CỌP hiếm có Bao check bất kỳ đâu Hỗ trợ bank 70% Lh trực tiếp để xem xe,"Kết nối Bluetooth, Dán phim cách nhiệt",Xăng 5.0 L,442,537 Nm,12.6L/100km,4600 x 1800 x 1450 mm,1493 kg
6416325,LandRover Range Rover Evoque R-Dynamic SE 2019,LandRover,2019,1785000000,5,Số tự động,Xăng,https://s.bonbanh.com/uploads/users/512513/car/6416325/m_1757041101.799.jpg,Vừa hạ lồng lên sóng ngay cho các cụ đây ạ #RangeRover Evoque màu xám bạc Sản xuất 2019 lăn bánh 4v km Giá chỉ bằng nửa lúc mua mới Alo e là xong,"Kết nối Bluetooth, Màn hình Android",Xăng 2.0 L,182,215 Nm,7.9L/100km,4600 x 1800 x 1450 mm,1317 kg
6457548,LandRover Range Rover Autobiography LWB 3.0 I6 P400 AWD 2021,LandRover,2021,6850000000,5,Số tự động,Xăng,https://s.bonbanh.com/uploads/users/783796/car/6457548/m_1764488075.895.jpg,"BÁN RANGE ROVER AUTOBIOGRAPHY LWB 400 – 2021 Thông tin chi tiết: Phiên bản: Autobiography LWB 400 Năm sản xuất: 2021 Số km: 35.000 km Tình trạng: Xe siêu lướt, giữ gìn kỹ, bao check hãng Trang bị & tiện nghi đỉnh cao: Động cơ I6 3.0L MHEV 400PS – mạnh mẽ, mượt mà, chuẩn SUV hạng sang Anh Quốc Trục c...","Cửa sổ trời, Kết nối Bluetooth, Camera 360, Màn hình Android",Xăng 3.0 L,263,335 Nm,13.0L/100km,4600 x 1800 x 1450 mm,1373 kg
6495661,LandRover Defender 110 X P400 3.0 AT 2023,LandRover,2023,6850000000,4,Số tự động,Xăng,https://s.bonbanh.com/uploads/users/783796/car/6495661/m_1764487887.758.jpg,"Xe Land Rover Defender 110 X Bản cao cấp nhất Xe sx 2023 chạy chưa tơi 10.000km Xe trang bị: Động cơ mạnh mẽ, hộp số tự động 8 cấp Hệ dẫn động 4 bánh toàn thời gian (AWD), khả năng off-road vượt trội Hệ thống treo khí nén điện tử, nâng – hạ gầm thông minh Cụm đèn LED Matrix, camera 360, cảm biến qua...","Camera 360, Cửa sổ trời, Cảm biến, Apple CarPlay, Ghế da",Xăng 3.0 L,260,308 Nm,13.2L/100km,4600 x 1800 x 1450 mm,1509 kg
6485368,LandRover Range Rover Autobiography LWB 3.0 I6 AWD 2024,LandRover,2024,12250000000,5,Số tự động,Hybrid,https://s.bonbanh.com/uploads/users/783796/car/6485368/m_1764488196.599.jpg,"Rover Autobiography LWB 3.0 siêu lướt sx 2024 - - Xe nhập khẩu chính hãng Full Option: Phanh khoảng cách, camera 360, hud kính, cảnh báo vưọt, cảnh báo va chạm, nâng hạ gầm, hộp lạnh, loa Meridian, ghế massage.... - - Bảo hành chính hãng 3 năm - - Miễn Phí 5 năm bảo dưỡng. Chi tiết vui lòng liên hệ ...","Lốp mới, Camera 360, Dán phim cách nhiệt",Hybrid 3.0 L,381,529 Nm,11.5L/100km,4600 x 1800 x 1450 mm,1505 kg
6404895,LandRover Range Rover Autobiography 5.0 2014,LandRover,2014,2280000000,4,Số tự động,Xăng,https://s.bonbanh.com/uploads/users/371796/car/6404895/m_1756294210.750.jpg,"Cần bán Range Rover Autobiography 5.0L sản xuất 2014 đã up full P400 Xe màu đen, nội thất màu đỏ cực chất chơi Mọi thứ nguyên bản đến hoàn hảo từ động cơ, khung gầm, hộp số Cam kết bằng văn bản, bao check bất kỳ đâu Lh trực tiếp để xem de và giá tốt nhất","Dán phim cách nhiệt, Màn hình Android",Xăng 5.0 L,436,518 Nm,12.7L/100km,4600 x 1800 x 1450 mm,1403 kg
6576961,LandRover Defender 110 P300 2.0 AT 2021,LandRover,2021,3099000000,4,Số tự động,Xăng,https://s.bonbanh.com/uploads/users/122163/car/6576961/m_1765854557.963.jpg,"Em sẵn ông vua địa hình LandRover_Defender_2021 màu đẹp như mới Ae nhanh tay nhé Màu nâu nội thất đen Odo:4v9 km Xe bao check test toàn quốc. Cam kết, không đâm đụng, không ngập nước k thuỷ kích, km chuẩn Hỗ trợ bank 70%","Dán phim cách nhiệt, Màn hình Android",Xăng 2.0 L,177,208 Nm,5.9L/100km,4600 x 1800 x 1450 mm,1510 kg
6506975,LandRover Range Rover Sport HSE 2014,LandRover,2014,1350000000,5,Số tự động,Xăng,https://s.bonbanh.com/uploads/users/749727/car/6506975/m_1762049350.348.jpg,"Range Rover HSE Sport – đỉnh cao SUV hạng sang model 2014 * Phiên bản 7 ghế cực đa dụng và ít hàng tại VN, Full Option • Odo 81.000km • Full bảo dưỡng chính hãng • Âm thanh Meridian,cửa hít,cốp điện,nâng hạ gầm,hộc lạnh,mui kính Panaroma toàn cảnh,màn hình Androi đa tính năng,5 chế độ lái địa hình.....","Kết nối Bluetooth, Màn hình Android",Xăng 3.0 L,272,336 Nm,11.2L/100km,4600 x 1800 x 1450 mm,1565 kg
5910960,LandRover Range Rover HSE 3.0 V6 2019,LandRover,2019,4686000000,5,Số tự động,Xăng,https://s.bonbanh.com/uploads/users/24576/car/5910960/m_1730692719.125.jpg,"Range Rover HSE 3.0V6 sx 2019, đi chuẩn 6,1 vạn km, bản full hãng, phom mới 2020, trang bị cửa trời toàn cảnh, hud kính, nâng hạ gầm tự động,cam 360, cốp điện, loa Meradiam, ... cam kết xe ko lỗi Hỗ trợ trả góp 70% Hỗ trợ biển đẹp định danh Hỗ trợ sang tên miễn phí","Lốp mới, Kết nối Bluetooth",Xăng 3.0 L,250,313 Nm,13.2L/100km,4600 x 1800 x 1450 mm,1410 kg
6571201,Lexus GX 460 2015,Lexus,2015,2290000000,7,Số tự động,Xăng,https://s.bonbanh.com/uploads/users/843866/car/6571201/m_1765523582.440.jpg,"GX460 Sản xuất 2015 xe chạy 11vạnkm xe công ty xuất hoá đơn 700triệu …... ✓ Option : cam sườn , nâng hạ gầm , hộp lạnh , loa mark , cửa sổ trời , gương ghế chỉnh điện đa hướng ,..","Lốp mới, Cửa sổ trời, Kết nối Bluetooth",Xăng 4.6 L,396,490 Nm,11.9L/100km,4600 x 1800 x 1450 mm,1560 kg
6579924,Lexus LM 500h 2025,Lexus,2025,7530000000,6,Số tự động,Hybrid,https://s.bonbanh.com/uploads/users/844925/car/6579924/m_1765986532.633.jpg,Lexus LM500h sx 2025 mới 100%. Phiển bản cập nhật cho 6 chỗ với một số tính năng sau: 1. Bổ sung và mở rộng vật liệu giảm rung và cách âm quanh khu vực bánh xe sau và cốp xe. Mang lại cảm giác êm ái và khả năng cách âm cho khoang hành khách bên tr...,"Lốp mới, Ghế da, Kết nối Bluetooth",Hybrid 2.4 L,309,457 Nm,8.2L/100km,4600 x 1800 x 1450 mm,1333 kg
6579949,Lexus LX 600 Vip 2025,Lexus,2025,9700000000,4,Số tự động,Xăng,https://s.bonbanh.com/uploads/users/844925/car/6579949/m_1765990358.897.jpg,"LIÊN HỆ ĐỂ NHẬN CHÍNH SÁCH TỐI ƯU KÈM HỖ TRỢ TỐT NHẤT ✓Bảo hành chính hãng 5 năm không giới hạn Km ✓Bảo dưỡng miễn phí hoàn toàn trong 3 năm (60,000km) ✓Thủ tục nhanh chóng – hoàn thiện trong ngày ✓Hỗ trợ ký hợp đồng tận nơi, giao xe tại nhà ✓Hỗ trợ toàn bộ thủ tục nộp thuế, đăng ký, đăng kiểm, đấu ...","Kết nối Bluetooth, Màn hình Android",Xăng 3.4 L,292,370 Nm,10.3L/100km,4600 x 1800 x 1450 mm,1311 kg
6579951,Lexus GX 550 Luxury 2025,Lexus,2025,6250000000,7,Số tự động,Xăng,https://s.bonbanh.com/uploads/users/844925/car/6579951/m_1765990630.562.jpg,"LIÊN HỆ ĐỂ NHẬN CHÍNH SÁCH TỐI ƯU KÈM HỖ TRỢ TỐT NHẤT ✓Bảo hành chính hãng 5 năm không giới hạn Km ✓Bảo dưỡng miễn phí hoàn toàn trong 3 năm (60,000km) ✓Thủ tục nhanh chóng – hoàn thiện trong ngày ✓Hỗ trợ ký hợp đồng tận nơi, giao xe tại nhà ✓Hỗ trợ toàn bộ thủ tục nộp thuế, đăng ký, đăng kiểm, đấu ...","Lốp mới, Màn hình Android",Xăng 3.4 L,304,358 Nm,12.4L/100km,4600 x 1800 x 1450 mm,1597 kg
6579946,Lexus LX 600 Urban 2025,Lexus,2025,8590000000,7,Số tự động,Xăng,https://s.bonbanh.com/uploads/users/844925/car/6579946/m_1765989987.435.jpg,"LIÊN HỆ ĐỂ NHẬN CHÍNH SÁCH TỐI ƯU KÈM HỖ TRỢ TỐT NHẤT ✓Bảo hành chính hãng 5 năm không giới hạn Km ✓Bảo dưỡng miễn phí hoàn toàn trong 3 năm (60,000km) ✓Thủ tục nhanh chóng – hoàn thiện trong ngày ✓Hỗ trợ ký hợp đồng tận nơi, giao xe tại nhà ✓Hỗ trợ toàn bộ thủ tục nộp thuế, đăng ký, đăng kiểm, đấu ...","Kết nối Bluetooth, Màn hình Android",Xăng 3.4 L,293,359 Nm,10.7L/100km,4600 x 1800 x 1450 mm,1321 kg
6579948,Lexus LX 600 Vip 2025,Lexus,2025,9700000000,4,Số tự động,Xăng,https://s.bonbanh.com/uploads/users/844925/car/6579948/m_1765990234.665.jpg,"LIÊN HỆ ĐỂ NHẬN CHÍNH SÁCH TỐI ƯU KÈM HỖ TRỢ TỐT NHẤT ✓Bảo hành chính hãng 5 năm không giới hạn Km ✓Bảo dưỡng miễn phí hoàn toàn trong 3 năm (60,000km) ✓Thủ tục nhanh chóng – hoàn thiện trong ngày ✓Hỗ trợ ký hợp đồng tận nơi, giao xe tại nhà ✓Hỗ trợ toàn bộ thủ tục nộp thuế, đăng ký, đăng kiểm, đấu ...","Lốp mới, Kết nối Bluetooth",Xăng 3.4 L,299,373 Nm,13.8L/100km,4600 x 1800 x 1450 mm,1532 kg
6571191,Lexus GX 550 M 2024,Lexus,2024,6600000000,7,Số tự động,Xăng,https://s.bonbanh.com/uploads/users/843866/car/6571191/m_1765523226.780.jpg,"Lexus GX550 Model 2025 - Màu trắng nội thất 2 màu nâu và đen cực sang trọng - Siêu Lướt 1vạn km như mới ✳️ Option : động cơ xăng V6 tăng áp kép 3.4L, nâm 21inch, cam 360, phang khoảng cách, giữ làn, cửa sổ trời, âm thanh vòm 21 loa Mark Levinson, .... - Cam kết chất lượng xe bằng văn bản - Check tes...","Lốp mới, Cửa sổ trời, Dán phim cách nhiệt",Xăng 3.4 L,280,340 Nm,12.6L/100km,4600 x 1800 x 1450 mm,1390 kg
6575178,Lexus LM 300h Royal Lounge 2020,Lexus,2020,4890000000,4,Số tự động,Hybrid,https://s.bonbanh.com/uploads/users/843866/car/6575178/m_1765768791.691.jpg,"- Lexus LM 300h - Hybrid - Sản xuất : 2020 - odo : 32.000km - Màu trắng nội thất kem Option : Động cơ I4 2.5L Hybrid (Xăng & Điện), hộp số vô cấp, hệ dẫn động AWD, đèn pha full led, la-zăng 17inch, loa mark levinson, màn hình sau 26inch, ghế vip có sấy sưởi làm mát massage, tủ lạnh, điều hoà 3 vùng,...","Lốp mới, Màn hình Android",Hybrid 2.5 L,313,468 Nm,6.0L/100km,4600 x 1800 x 1450 mm,1479 kg
6579950,Lexus GX 550 Luxury 2025,Lexus,2025,6200000000,7,Số tự động,Xăng,https://s.bonbanh.com/uploads/users/844925/car/6579950/m_1765990535.889.jpg,"LIÊN HỆ ĐỂ NHẬN CHÍNH SÁCH TỐI ƯU KÈM HỖ TRỢ TỐT NHẤT ✓Bảo hành chính hãng 5 năm không giới hạn Km ✓Bảo dưỡng miễn phí hoàn toàn trong 3 năm (60,000km) ✓Thủ tục nhanh chóng – hoàn thiện trong ngày ✓Hỗ trợ ký hợp đồng tận nơi, giao xe tại nhà ✓Hỗ trợ toàn bộ thủ tục nộp thuế, đăng ký, đăng kiểm, đấu ...","Kết nối Bluetooth, Màn hình Android",Xăng 3.4 L,291,361 Nm,13.8L/100km,4600 x 1800 x 1450 mm,1401 kg
6579952,Lexus RX 350h Luxury 2025,Lexus,2025,4330000000,5,Số tự động,Hybrid,https://s.bonbanh.com/uploads/users/844925/car/6579952/m_1765990944.654.jpg,"LIÊN HỆ ĐỂ NHẬN CHÍNH SÁCH TỐI ƯU KÈM HỖ TRỢ TỐT NHẤT ✓Bảo hành chính hãng 5 năm không giới hạn Km ✓Bảo dưỡng miễn phí hoàn toàn trong 3 năm (60,000km) ✓Thủ tục nhanh chóng – hoàn thiện trong ngày ✓Hỗ trợ ký hợp đồng tận nơi, giao xe tại nhà ✓Hỗ trợ toàn bộ thủ tục nộp thuế, đăng ký, đăng kiểm, đấu ...","Cửa sổ trời, Camera 360, Ghế da",Hybrid 2.5 L,334,514 Nm,8.3L/100km,4600 x 1800 x 1450 mm,1343 kg
6575898,Lexus LX 570 2010,Lexus,2010,1960000000,7,Số tự động,Xăng,https://s.bonbanh.com/uploads/users/843866/car/6575898/m_1765788151.336.jpg,"Lexus Lx570 sản xuất 2010 - Up full trong ngoài supersport model 2021 hàng chính hãng tổng đồ độ 1 tỷ - Xe cam kết không đâm đụng, không ngập nước, bao check hãng toàn quốc. - Hỗ trợ sang tên đổi chủ, thủ tục giấy tờ pháp lý rõ ràng. - Chế độ bảo hành hậu mãi, chăm sóc xe miễn phí sau khi mua xe Liê...","Lốp mới, Kết nối Bluetooth",Xăng 5.7 L,488,584 Nm,13.5L/100km,4600 x 1800 x 1450 mm,1390 kg
6579944,Lexus LX 600 Urban 2025,Lexus,2025,8590000000,7,Số tự động,Xăng,https://s.bonbanh.com/uploads/users/844925/car/6579944/m_1765989786.380.jpg,"LIÊN HỆ ĐỂ NHẬN CHÍNH SÁCH TỐI ƯU KÈM HỖ TRỢ TỐT NHẤT ✓Bảo hành chính hãng 5 năm không giới hạn Km ✓Bảo dưỡng miễn phí hoàn toàn trong 3 năm (60,000km) ✓Thủ tục nhanh chóng – hoàn thiện trong ngày ✓Hỗ trợ ký hợp đồng tận nơi, giao xe tại nhà ✓Hỗ trợ toàn bộ thủ tục nộp thuế, đăng ký, đăng kiểm, đấu ...","Lốp mới, Dán phim cách nhiệt",Xăng 3.4 L,299,366 Nm,10.6L/100km,4600 x 1800 x 1450 mm,1540 kg
6469474,Lexus LM 500h 2025,Lexus,2025,8999000000,6,Số tự động,Hybrid,https://s.bonbanh.com/uploads/users/468784/car/6469474/m_1759977566.185.jpg,"Lexus LM500h sản xuất 2025, chạy 1.000km - tên Cty xhđ Bản 6 ghế màu Xám nội thất Kem","Lốp mới, Dán phim cách nhiệt",Hybrid 2.4 L,291,453 Nm,7.2L/100km,4600 x 1800 x 1450 mm,1449 kg
6579927,Lexus LM 500h 2025,Lexus,2025,8950000000,4,Số tự động,Hybrid,https://s.bonbanh.com/uploads/users/844925/car/6579927/m_1765986653.965.jpg,"Lexus LM500h sx 2025 mới 100%. Phiển bản nâng cấp cho 4 chỗ, điều chỉnh tăng giá 240 triệu so với phiên bản cũ, kèm theo các nâng cấp sau: 1. Bổ sung và mở rộng vật liệu giảm rung và cách âm quanh khu vực bánh xe sau và cốp xe. Mang lại cảm giác êm...","Kết nối Bluetooth, Màn hình Android",Hybrid 2.4 L,303,432 Nm,9.0L/100km,4600 x 1800 x 1450 mm,1463 kg
6493058,Lexus LM 500h 2025,Lexus,2025,8999000000,6,Số tự động,Hybrid,https://s.bonbanh.com/uploads/users/838565/car/6493058/m_1761236353.152.jpg,Chính chủ cần bán Lexus LM500h sản xuất 2025 chạy 900km Màu Xám Sonic nội thất Kem 6 ghế Tên công ty,"Lốp mới, Dán phim cách nhiệt",Hybrid 2.4 L,307,433 Nm,5.8L/100km,4600 x 1800 x 1450 mm,1406 kg
6579937,Lexus RX 350 Luxury 2023,Lexus,2023,3979000000,5,Số tự động,Xăng,https://s.bonbanh.com/uploads/users/661625/car/6579937/m_1765987499.403.jpg,"mới 3v7km màu trắng dán decal xanh nội thất kem một chủ đẹp chuẩn mới tinh. Xe nhập Nhật sản xuất 2023 đăng kí mới 6/2024 một chủ từ đầu chạy ít mới tinh,thuộc bản #Luxury với thiết kế hoàn toàn mới, hệ thống khung gầm mới cứng, nhẹ hơn và tối ưu hơn mẫu cũ Option trang bị sẵn nhiều,vật liệu da gỗ c...","Apple CarPlay, Kết nối Bluetooth, Camera 360, Dán phim cách nhiệt",Xăng 2.4 L,214,262 Nm,7.1L/100km,4600 x 1800 x 1450 mm,1440 kg
6540593,Lexus LX 600 Vip 2025,Lexus,2025,10190000000,4,Số tự động,Xăng,https://s.bonbanh.com/uploads/users/656145/car/6540593/m_1763878806.334.jpg,"Lexus LX600 VIP - Sản xuất 2025 cá nhân - Odo 6000 km Đã dán full PDF - Dá có thương lượng ACE nhé ! Xem xe tại Số 2 Hạ Yên Quyết, HN","Màn hình Android, Dán phim cách nhiệt",Xăng 3.4 L,302,378 Nm,10.2L/100km,4600 x 1800 x 1450 mm,1459 kg
6470593,Lexus GX 460 2020,Lexus,2020,4190000000,7,Số tự động,Xăng,https://s.bonbanh.com/uploads/users/833265/car/6470593/m_1760014179.959.jpg,"Một chiếc Lexus GX460 2020 Model 2021 – biểu tượng của đẳng cấp và uy lực. Màu Đen phối nội thất Kem, xe công ty xuất hóa đơn 1 tỷ 500, odo hơn 4v km, full lịch sử bảo dưỡng tại hãng. Xe giữ như mới, tinh tế đến từng chi tiết – dành cho người hiểu giá trị của sự hoàn hảo.","Lốp mới, Kết nối Bluetooth",Xăng 4.6 L,386,464 Nm,10.5L/100km,4600 x 1800 x 1450 mm,1498 kg
6573399,Lexus ES 250 F Sport 2022,Lexus,2022,2150000000,5,Số tự động,Xăng,https://s.bonbanh.com/uploads/users/656145/car/6573399/m_1765633562.502.jpg,Lexus Es 250 F Sport sx 2022 Màu đen - nội thất đỏ đen xe chạy 6vạn9km xe cực đẹp không 1 lỗi nhỏ dá có thương lượng ACE nhé,"Lốp mới, Kết nối Bluetooth",Xăng 2.5 L,227,268 Nm,6.1L/100km,4600 x 1800 x 1450 mm,1302 kg
6545969,Lexus LX 600 Vip 2025,Lexus,2025,10068000000,4,Số tự động,Xăng,https://s.bonbanh.com/uploads/users/755604/car/6545969/m_1764396873.338.jpg,Lexus LX600 VIP sx 2025 Bản Vip 4 ghế thương gia Xe 1 chủ tư nhân - 6000miles Xe đã đang wrap gói PPF full ngoại - nội thất - Xe đã được kiểm tra đầu vào cực kì kĩ lưỡng khi đến tay quý khách hàng. - Luôn cam kết chất lượng bằng văn bản - Giá xe hiện salon đang rao bán công khai trên sàn nhưng sẽ cò...,"Lốp mới, Kết nối Bluetooth",Xăng 3.4 L,305,371 Nm,10.6L/100km,4600 x 1800 x 1450 mm,1517 kg
5806800,Mazda 2 1.5 AT 2016,Mazda,2016,300000000,5,Số tự động,Xăng,https://s.bonbanh.com/uploads/users/663282/car/5806800/m_1725498272.983.jpg,"Xe đẹp không đâm đụng máy móc zin keo chỉ zin chủ cũ là nữ giáo viên hiệu phó chạy rất ít rất cẩn thận chăm sóc xe , Anh em có nhu cầu liên hệ trực tiếp để biết thêm chi tiết về xe .","Lốp mới, Dán phim cách nhiệt",Xăng 1.5 L,135,174 Nm,5.5L/100km,4600 x 1800 x 1450 mm,1495 kg
6211905,Mazda 3 1.5 AT 2018,Mazda,2018,430000000,5,Số tự động,Xăng,https://s.bonbanh.com/uploads/users/663282/car/6211905/m_1745852364.341.jpg,Anh Em nào có nhu cầu liên hệ Xe đẹp về chỉ việc chạy keo chỉ zin không ngập nước .,"Kết nối Bluetooth, Dán phim cách nhiệt",Xăng 1.5 L,141,172 Nm,8.0L/100km,4600 x 1800 x 1450 mm,1585 kg
6542288,Mazda 2 Sport Luxury 2021,Mazda,2021,435000000,5,Số tự động,Xăng,https://s.bonbanh.com/uploads/users/146450/car/6542288/m_1763974542.115.jpg,"Mazda 2 Sport Luxury 2021 nhìn ngoài đã mê, chạy rồi còn nghiện hơn Odo đúng 2v km Nội ngoại thất như xe trưng bày Form mới, lái đầm chắc, tiết kiệm mà vẫn rất sướng Xe nói thật càng soi càng đẹp Không đâm va không ngập nước không tua km Anh em mang đi check test thoải mái, chuẩn mới chốt nhé","Dán phim cách nhiệt, Màn hình Android",Xăng 1.5 L,138,161 Nm,6.9L/100km,4600 x 1800 x 1450 mm,1326 kg
6556202,Mazda CX5 Premium Exclusive 2.0 AT 2023,Mazda,2023,799000000,5,Số tự động,Xăng,https://s.bonbanh.com/uploads/users/574593/car/6556202/m_1764742717.525.jpg,"Xe đẹp quá các bác ạ ! - Mazda CX5 Premium exclusive 2023 màu trắng - Xe 1 chủ 3 vạn km zin, dàn lốp theo xe, sơ cua chưa hạ, Full bảo dưỡng hãng - Chất xe zin nguyên bản, máy số keo chỉ, check tét thoải mái - Chủ giữ gìn, xem xe là ưng ngay - Có bán trả góp, có đổi xe các loại - Thiện chí xem xe al...","Lốp mới, Dán phim cách nhiệt",Xăng 2.0 L,181,209 Nm,8.7L/100km,4700 x 1860 x 1700 mm,1766 kg
6548893,Mazda 3 1.5L Luxury 2025,Mazda,2025,625000000,5,Số tự động,Xăng,https://s.bonbanh.com/uploads/users/686490/car/6548893/m_1764327072.319.jpg,"Mazda3 1.5AT Luxury 2025 Odo 1.000 km Giao xe toàn quốc Hỗ trợ bank tối đa 70% AUTO16 – 68 Đinh Núp, Cầu Giấy, Hà Nội","Lốp mới, Kết nối Bluetooth",Xăng 1.5 L,143,173 Nm,6.7L/100km,4600 x 1800 x 1450 mm,1432 kg
6550462,Mazda 3 1.5L Luxury 2024,Mazda,2024,600000000,5,Số tự động,Xăng,https://s.bonbanh.com/uploads/users/686490/car/6550462/m_1764421304.422.jpg,"Mazda3 1.5AT Luxury 2024 Bank 70% toàn quốc xe đẹp chuẩn, chất máy gầm cực nét. AUTO16 – 68 Đinh Núp, Cầu Giấy, Hà Nội Cam kết chất lượng văn bản – hỗ trợ check/test xe thoải mái.","Kết nối Bluetooth, Màn hình Android",Xăng 1.5 L,120,145 Nm,7.9L/100km,4600 x 1800 x 1450 mm,1554 kg
6555682,Mazda CX 30 Premium 2.0 AT 2022,Mazda,2022,610000000,5,Số tự động,Xăng,https://s.bonbanh.com/uploads/users/686490/car/6555682/m_1764727917.254.jpg,"Mazda CX-30 2.0 Premium 2022 Odo 6 vạn km, một chủ từ mới Hỗ trợ bank 70%, check test thoải mái. AUTO16 – 68 Đinh Núp, Yên Hòa, Cầu Giấy, Hà Nội","Kết nối Bluetooth, Dán phim cách nhiệt",Xăng 2.0 L,164,199 Nm,9.5L/100km,4600 x 1800 x 1450 mm,1317 kg
