id,name,brand,year,price,seats,transmission,fuelType,image,description,features,engine,horsepower,torque,fuelConsumption,dimensions,weight
5596056,Ford Everest Platinum 2.0L 4x4 AT 2025,Ford,2025,1545000000,7,Số tự động,Dầu,https://s.bonbanh.com/uploads/users/65143/car/5596056/m_1714878862.691.jpeg,"FORD EVEREST PLATINUM - KHUYẾN MÃI HẤP DẪN TRONG THÁNG! Đặt cọc trực tuyến, giao xe ngay - Ghế da thiết kế mới sang trọng có sưởi ghế - Hệ thống giải trí âm thanh B&O - Thiết kế Ngoại thất đẳng cấp Xem xe ngay tại Phú Mỹ Ford","Ghế da, Kết nối Bluetooth, Màn hình Android",Dầu 2.0 L,162,190 Nm,6.2L/100km,4700 x 1860 x 1700 mm,1800 kg
6579080,Ford EcoSport Titanium 1.5L AT 2015,Ford,2015,299000000,5,Số tự động,Xăng,https://s.bonbanh.com/uploads/users/746029/car/6579080/m_1765954186.943.jpg,"5 chỗ gầm cao cực chất Ford Ecosport 2015 1.5 Titanium Odo: 4v km zin Xe cá nhân sử dụng, bảo dưỡng chính hãng Trang bị: Màn Hình, cam lùi, cam hành trình, ghế da zin theo xe, dàn lốp mới thay, Cảm biến áp suất lốp, Đèn Bi Led siêu sáng, ... Giá bao rút hồ sơ gốc","Dán phim cách nhiệt, Ghế da, Cảm biến, Màn hình Android",Xăng 1.5 L,119,137 Nm,5.8L/100km,4600 x 1800 x 1450 mm,1316 kg
6571984,Ford Everest Titanium 2.0L 4x4 AT 2020,Ford,2020,1005000000,7,Số tự động,Dầu,https://s.bonbanh.com/uploads/users/536753/car/6571984/m_1765549456.526.jpg,"FORD EVEREST TITANIUM AT 4x4 2024 - Giá xe còn thương lượng - Xe trang bị nhiều phụ kiện - Xe Full lịch sử bảo dưỡng, 1 đời chủ - Tặng phiếu thay nhớt và lọc nhớt 3 lần - Xe bán ra tại Ford chuẩn xe: ✳ Cam kết 3 KHÔNG: KHÔNG ĐÂM ĐỤNG - KHÔNG THUỶ KÍCH - KHÔNG TUA ĐỒNG HỒ ✓ Bảo đảm tính pháp lý, ✓ Bả...","Lốp mới, Dán phim cách nhiệt",Dầu 2.0 L,182,213 Nm,6.7L/100km,4700 x 1860 x 1700 mm,1722 kg
6568026,Ford Everest Titanium Plus 2.0L 4x4 AT 2025,Ford,2025,1468000000,7,Số tự động,Dầu,https://s.bonbanh.com/uploads/users/806255/car/6568026/m_1765357537.919.jpg,#banxe #ford #Everest titamium 4x4 Sản xuất 2025 nhập khẩu biển Hà Nội ODO 9000 km giá tham khảo vui vẻ em bán rẻ Anh chị tới xem xe trực tiếp có bớt,"Kết nối Bluetooth, Màn hình Android",Dầu 2.0 L,183,220 Nm,7.4L/100km,4700 x 1860 x 1700 mm,2044 kg
6555990,Ford Everest Titanium 2.0L 4x2 AT 2024,Ford,2024,1229000000,7,Số tự động,Dầu,https://s.bonbanh.com/uploads/users/640881/car/6555990/m_1764735615.420.jpg,#banxe #ford #Everest titamium 4x2 Sản xuất 5/2024 nhập khẩu biển Hà Nội ODO 1.vạn km giá tham khảo vui vẻ em bán rẻ Anh chị tới xem xe trực tiếp có bớt ̂́ ̛ ̛̣,"Kết nối Bluetooth, Màn hình Android",Dầu 2.0 L,169,205 Nm,7.7L/100km,4700 x 1860 x 1700 mm,1773 kg
6550929,Ford Everest Platinum 2.0L 4x4 AT 2025,Ford,2025,1585000000,7,Số tự động,Dầu,https://s.bonbanh.com/uploads/users/686490/car/6550929/m_1764471254.224.jpg,"Ford Everest Platinum 2025 Odo 5.000 km – xe lướt như mới Hỗ trợ bank tối đa 70% Cam kết xe chuẩn, pháp lý minh bạch, check test thoải mái AUTO16 – 68 Đinh Núp, Cầu Giấy, Hà Nội","Kết nối Bluetooth, Dán phim cách nhiệt",Dầu 2.0 L,176,208 Nm,5.9L/100km,4700 x 1860 x 1700 mm,1793 kg
6547591,Ford Ranger XLS 2.2L 4x2 AT 2019,Ford,2019,499000000,5,Số tự động,Dầu,https://s.bonbanh.com/uploads/users/686490/car/6547591/m_1764250838.612.jpg,"Ford Ranger XLS 2.2 2019 (nhập Thái Lan) Hỗ trợ bank tối đa 70% Cam kết xe chuẩn, pháp lý minh bạch, check test thoải mái AUTO16 – 68 Đinh Núp, Cầu Giấy, Hà Nội Cam kết chất lượng văn bản – hỗ trợ check/test xe theo nhu cầu.","Lốp mới, Kết nối Bluetooth",Dầu 2.2 L,190,242 Nm,7.9L/100km,4600 x 1800 x 1450 mm,1553 kg
6545105,Ford Ranger Raptor 2.0L 4x4 AT 2025,Ford,2025,1190000000,5,Số tự động,Dầu,https://s.bonbanh.com/uploads/users/686490/car/6545105/m_1764132000.513.jpg,"Ford Ranger Raptor 2.0L 4x4 – SX 2025, đăng ký T7/2025 Odo: 9.000km – xe siêu lướt, như mới Giao xe toàn quốc Hỗ trợ bank tối đa 70% AUTO16 – 68 Đinh Núp, Cầu Giấy, Hà Nội","Kết nối Bluetooth, Màn hình Android",Dầu 2.0 L,189,237 Nm,9.1L/100km,4600 x 1800 x 1450 mm,1361 kg
5700273,Honda Accord 2.4 AT 2008,Honda,2008,265000000,5,Số tự động,Xăng,https://s.bonbanh.com/uploads/users/663282/car/5700273/m_1719986541.971.jpg,"Honda Accord đời 2008 Xe đẹp Anh Em nào có nhu cầu liên hệ để biết thêm chi tiết ,bao rút hồ sơ.","Màn hình Android, Dán phim cách nhiệt",Xăng 2.4 L,213,245 Nm,8.6L/100km,4600 x 1800 x 1450 mm,1569 kg
6528157,Honda HRV G 2025,Honda,2025,620000000,5,Số tự động,Xăng,https://s.bonbanh.com/uploads/users/841217/car/6528157/m_1763178093.957.jpg,"Liên hệ trực tiếp hỗ trợ thêm: - Tiền mặt - Phụ kiện chính hãng - Tặng thẻ dịch vụ 20tr - Miễn phí gia hạn thêm bảo hành 2 năm Honda HR-V G ✓️ Động cơ 1.5 i-VTEC đạt 119 mã lực, tiết kiệm nhiên liệu. ✓️ Nhập Thái Lan 100%, chất lượng vượt trội - Vô lăng 3 chấu cùng màn hình trung tâm giải trí 8 inch...","Apple CarPlay, Lốp mới, Kết nối Bluetooth",Xăng 1.5 L,137,156 Nm,9.3L/100km,4600 x 1800 x 1450 mm,1365 kg
6575863,Honda CRV 2.4 AT 2011,Honda,2011,335000000,5,Số tự động,Xăng,https://s.bonbanh.com/uploads/users/574593/car/6575863/m_1765786959.777.jpg,"HÀNG HIẾM CÓ KHÓ TÌM: - Honda CRV 2.4L 2011 “7,5 vạn km zin” sau 14 năm lăn bánh, khó tìm được chiếc thứ 2 - Xe 1 chủ từ mới, rất giữ gìn, 2 chìa khoá zin, sơ cua chưa hạ,..xem là ưng ngay - Thân vỏ keo chỉ zin, máy số zin, nội thất ghế da, vô lăng củ số zin,.. - Nhận cọc online, check tét thoải mái...","Ghế da, Kết nối Bluetooth, Dán phim cách nhiệt",Xăng 2.4 L,201,259 Nm,9.4L/100km,4600 x 1800 x 1450 mm,1310 kg
6548471,Honda Civic 1.8 AT 2015,Honda,2015,370000000,5,Số tự động,Xăng,https://s.bonbanh.com/uploads/users/483031/car/6548471/m_1764312263.829.jpg,"Honda Civic 1.8AT Sx 2015 Tư nhân chính chủ sử dụng xe đẹp ko lỗi Odo 8v5 km Trong bị : cam360 , đề nổ start/stop , đã lên bộ loa trầm xịn, cam trước sau đầy đủ…. Mua Ô Tô Cũ giá cạnh tranh, ưu tiên Xe Đẹp, Chính Chủ","Start/Stop, Lốp mới, Kết nối Bluetooth",Xăng 1.8 L,168,205 Nm,5.8L/100km,4600 x 1800 x 1450 mm,1303 kg
6392481,Honda BR V L 2025,Honda,2025,630000000,7,Số tự động,Xăng,https://s.bonbanh.com/uploads/users/583932/car/6392481/m_1755594832.165.jpg,"Honda BRV L hoàn toàn mới - Chương trình khuyến mãi hot nhất trong tháng: Giảm tiền mặt, tặng phụ kiện, bảo hiểm,... - Hỗ trợ trả góp lãi suất ưu đãi, thủ tục nhanh chóng - Liên hệ ngay để biết thêm thông tin. *** -DxRxC (mm) 4490x1780x1685 -Chiều dài cơ sở (mm) 2700 ✓ Hệ thống phanh giảm thiểu va c...","Kết nối Bluetooth, Màn hình Android",Xăng 1.5 L,139,184 Nm,9.0L/100km,4600 x 1800 x 1450 mm,1587 kg
6523829,Honda HRV G 2025,Honda,2025,624000000,5,Số tự động,Xăng,https://s.bonbanh.com/uploads/users/583932/car/6523829/m_1763103604.188.jpg,"✓️ Sử dụng động cơ nhỏ gọn hơn 1.5 i-VTEC đạt 119 mã lực, tiết kiệm nhiên liệu. ✓️ Nhập Thái Lan 100%, chất lượng vượt trội Trang bị Hệ thống Hỗ trợ Lái xe An Toàn 6 tính năng: • Hệ thống phanh giảm thiểu va chạm (CMBS) • Hệ thống đèn pha thích ứng tự động (AHB) • Hệ thống kiểm soát hành trình thích...","Lốp mới, Dán phim cách nhiệt",Xăng 1.5 L,118,146 Nm,7.3L/100km,4600 x 1800 x 1450 mm,1483 kg
6392328,Honda CRV L 2025,Honda,2025,999000000,7,Số tự động,Xăng,https://s.bonbanh.com/uploads/users/583932/car/6392328/m_1755591738.254.jpg,"Những điểm nổi bật trên Honda CR-V mới: - Công nghệ hỗ trợ lái xe an toàn tiên tiến Honda SENSING - Camera quan sát làn đường - Sạc không dây tiện ích - Cốp điện với tính năng mở cốp rảnh tay - Camera lùi 3 góc quay - Gạt mưa tự động, - Cửa sổ trời toàn cảnh ...","Cửa sổ trời, Dán phim cách nhiệt, Màn hình Android",Xăng 1.5 L,121,161 Nm,8.1L/100km,4600 x 1800 x 1450 mm,1346 kg
6392279,Honda City RS 1.5 AT 2025,Honda,2025,504000000,5,Số tự động,Xăng,https://s.bonbanh.com/uploads/users/583932/car/6392279/m_1755590639.856.jpg,"Honda City RS phiên bản nâng cấp Có thêm Honda Sensing và Honda Connect - Chương trình khuyến mãi hot nhất trong tháng - Hỗ trợ trả góp lãi suất ưu đãi, thủ tục nhanh chóng - Liên hệ ngay để biết thêm thông tin. *** Trang bị mới: - Đề nổ máy từ xa bằng chìa khóa. - Hệ thống an toàn 6 túi khí, Cân bằ...","Túi khí, Kết nối Bluetooth, ABS, Màn hình Android",Xăng 1.5 L,117,145 Nm,6.9L/100km,4600 x 1800 x 1450 mm,1359 kg
6562465,Honda CRV e:HEV RS 2024,Honda,2024,1269000000,5,Số tự động,Hybrid,https://s.bonbanh.com/uploads/users/686490/car/6562465/m_1765079724.649.jpg,"Honda CR-V HEV 2024 – Hàng siêu mới Odo 1.500 km – xe như hãng xuất bãi Tình trạng: sơn zin, nội thất mới tinh, chất lượng chuẩn Giao xe toàn quốc – hỗ trợ bank tối đa 70% AUTO16 – 68 Đinh Núp, Hà Nội Cam kết xe chuẩn – hỗ trợ check/test hãng toàn quốc","Kết nối Bluetooth, Màn hình Android",Hybrid 2.0 L,267,374 Nm,9.3L/100km,4600 x 1800 x 1450 mm,1348 kg
6528107,Honda BR V L 2025,Honda,2025,629000000,7,Số tự động,Xăng,https://s.bonbanh.com/uploads/users/841217/car/6528107/m_1763177007.718.jpg,"Liên hệ trực tiếp hỗ trợ thêm: - Tiền mặt - Phụ kiện chính hãng - Tặng thẻ dịch vụ 20tr - Miễn phí gia hạn thêm bảo hành 2 năm Honda BRV L -DxRxC (mm) 4490x1780x1685 -Chiều dài cơ sở (mm) 2700 ✓️ Động cơ 1.5 i-VTEC đạt 119 mã lực, tiết kiệm nhiên liệu. ✓️ Nhập Thái Lan 100%, chất lượng vượt trội Tra...","Lốp mới, Dán phim cách nhiệt",Xăng 1.5 L,142,187 Nm,7.0L/100km,4600 x 1800 x 1450 mm,1451 kg
6562043,Honda CRV L 2019,Honda,2019,755000000,7,Số tự động,Xăng,https://s.bonbanh.com/uploads/users/656145/car/6562043/m_1765031571.560.jpg,Honda CRV L 2019 đky 2020 nhập Thái 1 chủ từ đầu xe chạy 7 vạn km zin. Full lịch sử bảo dưỡng hãng. Xe đẹp xuất sắc.Cam kết chất lượng dá 7có thương lượng ACE nhé,"Kết nối Bluetooth, Màn hình Android",Xăng 1.5 L,134,160 Nm,5.7L/100km,4600 x 1800 x 1450 mm,1489 kg
6578424,Honda Civic e:HEV RS 2.0 AT 2024,Honda,2024,925000000,5,Số tự động,Hybrid,https://s.bonbanh.com/uploads/users/181593/car/6578424/m_1765933893.400.jpg,Nam Dương Auto vừa về Honda Civic bản HEV cao cấp. Xe sx 2024 chạy zin 5000km mới 98% Quý khách có nhu cầu vui lòng liên hệ trực tiếp để biết thêm chi tiết,"Lốp mới, Dán phim cách nhiệt",Hybrid 2.0 L,259,356 Nm,8.5L/100km,4600 x 1800 x 1450 mm,1341 kg
6579828,Honda CRV G 2023,Honda,2023,830000000,7,Số tự động,Xăng,https://s.bonbanh.com/uploads/users/75636/car/6579828/m_1765980259.461.jpg,"Honda CRV G sensing 1.5 Turbo, số tự động, sản xuất 2023, 1 chủ mua mới, đi chuẩn 38 ngàn km, đầy đủ đồ chơi: ghế da có chỉnh điện, màn hình, cam lùi, đề nút start/stop, phanh tay điện tử, lẫy chuyển số trên vô lăng, ga tự động, chống lệch làn, bám đuôi xe phía trước giữ khoảng cách, lót sàn, dán cá...","Start/Stop, Ghế da, Kết nối Bluetooth, Dán phim cách nhiệt",Xăng 1.5 L,138,179 Nm,9.0L/100km,4600 x 1800 x 1450 mm,1303 kg
6574316,Honda CRV 2.4 AT 2010,Honda,2010,286000000,5,Số tự động,Xăng,https://s.bonbanh.com/uploads/users/84519/car/6574316/m_1765703362.268.jpg,"Gia đình cần bán xe Crv bản 2.4 nguyên bản chính chủ xe đẹp này cần nâng đời xe , xem xe tại nhà miễn tiếp thợ , xin cảm ơn !","Kết nối Bluetooth, Dán phim cách nhiệt",Xăng 2.4 L,196,250 Nm,7.6L/100km,4600 x 1800 x 1450 mm,1344 kg
6496110,Honda CRV 2.4 AT 2010,Honda,2010,316000000,5,Số tự động,Xăng,https://s.bonbanh.com/uploads/users/539386/car/6496110/m_1761405695.593.jpg,"✓ Mới về 2010 Honda CRV số tự động, Zin từ nắp dàn cò, ghế chỉnh điện, Biển Hà Nội, màn hình Led, camera lùi, gầm cao máy thoáng, odo 17 vạn km, chính chủ nâng niu sử dụng, động cơ, hộp số zin nguyên bản, hỗ trợ trả thẳng trả góp 6-70% ✓ Mời các bác alo em Phương để trải nghiệm bất cứ mẫu xe nào vì ...","Lốp mới, Kết nối Bluetooth",Xăng 2.4 L,207,250 Nm,8.1L/100km,4600 x 1800 x 1450 mm,1380 kg
6206542,Honda CRV L 2025,Honda,2025,1099000000,7,Số tự động,Xăng,https://s.bonbanh.com/uploads/users/191384/car/6206542/m_1745567989.566.jpg,Em xin cập nhật chương trình bán hàng tháng 12/2025 + Bản CR-V L: Giảm tiền mặt 95tr + Phụ kiện + Xe đạp Modulo - Có đủ xe đủ màu giao ngay cuối tháng 12/2025 ( Liên hệ để tham khảo chương trình khuyến mãi theo ) Hổ trợ vay ngân hàng 85% giá trị xe Ngoài giá khuyến mãi trên quý khách hàng có nhu cầu...,"Lốp mới, Kết nối Bluetooth",Xăng 1.5 L,143,171 Nm,8.9L/100km,4600 x 1800 x 1450 mm,1469 kg
6550600,Honda CRV L 2024,Honda,2024,1048000000,7,Số tự động,Xăng,https://s.bonbanh.com/uploads/users/694240/car/6550600/m_1764758367.873.jpg,"Crv L 2024 Odo 1.8v km Sơn zin 99% Honda CR-V bản L gây ấn tượng với nhiều trang bị đáng tiền, cao cấp như: Màn hình cảm ứng 9 inch – Hỗ trợ kết nối Apple CarPlay/Android Auto không dây, giúp bạn dễ dàng sử dụng các ứng dụng điện thoại trên màn hình xe. Hệ thống âm thanh 8 loa mang đến âm thanh chất...","Apple CarPlay, Lốp mới, Màn hình Android",Xăng 1.5 L,133,170 Nm,9.0L/100km,4600 x 1800 x 1450 mm,1592 kg
6203092,Honda CRV L AWD 2025,Honda,2025,1250000000,7,Số tự động,Xăng,https://s.bonbanh.com/uploads/users/191384/car/6203092/m_1751350763.658.jpg,Em xin cập nhật chương trình bán hàng tháng 12/2025 Honda CRV L hiện bên em có xe giao cho quý khách hàng HIỆN BÊN ĐẠI LÝ EM CÓ XE SẴN GIAO NGAY - Xe được LẮP RÁP TRONG NƯỚC + Bản CR-V L AWD : Giảm tiền mặt 40tr + Phụ Kiện cao cấp theo xe Hổ trợ vay ngân hàng 85% giá trị xe Ngoài giá khuyến mãi trên...,"Lốp mới, Màn hình Android",Xăng 1.5 L,137,156 Nm,7.3L/100km,4600 x 1800 x 1450 mm,1537 kg
6562299,Honda CRV L 2024,Honda,2024,1020000000,7,Số tự động,Xăng,https://s.bonbanh.com/uploads/users/689517/car/6562299/m_1765072214.651.jpg,"HONDA Ô TÔ SÀI GÒN Quận 7- XE CHÍNH HÃNG ĐÃ QUA SỬ DỤNG Xin kính chào quý khách: HONDA CRV L xanh 2024 ✓ Năm sản xuất: 2024 ✓ Odo: 23.000 km ✓ Màu ngoại thất: Xanh Xe đã lên nhiều trang bị: Phim cách nhiệt, nẹp bước chân, thảm sàn 5D… Chất xe còn rất mới - Nội ngoại thất sạch sẽ - Bàn giao xe đã đượ...","Kết nối Bluetooth, Màn hình Android",Xăng 1.5 L,144,165 Nm,8.7L/100km,4600 x 1800 x 1450 mm,1343 kg
6564431,Honda Brio RS 2021,Honda,2021,355000000,5,Số tự động,Xăng,https://s.bonbanh.com/uploads/users/689517/car/6564431/m_1765182336.413.jpg,HONDA Ô TÔ SÀI GÒN Quận 7- XE CHÍNH HÃNG ĐÃ QUA SỬ DỤNG Xin kính chào quý khách: HONDA Brio RS cam ✓ Năm sản xuất: 2021 ✓ Odo: 32.000 km ✓ Màu ngoại thất: Cam Chất xe còn rất mới - Nội ngoại thất sạch sẽ - Bàn giao xe đã được hãng vệ sinh. Hỗ trợ ngân hàng tối đa 70% giá trị xe thẩm định. Honda Sài ...,"Lốp mới, Kết nối Bluetooth",Xăng 1.2 L,120,139 Nm,6.4L/100km,4600 x 1800 x 1450 mm,1337 kg
6579945,Hyundai SantaFe Hybrid 1.6 HTRAC 2022,Hyundai,2022,1180000000,7,Số tự động,Hybrid,https://s.bonbanh.com/uploads/users/360061/car/6579945/m_1765989879.620.jpg,"Huyndai Santafe Hybrid 1.6AT HTrac 2022 Đăng kí tên tư nhân Odo : 60.000km sai 1 mét Đốt xe Trang bị : Màn giải trí cảm 10.25 inch .Hệ thống giải trí Apple Carplay/Android Auto/ Bluetooth/ AUX/ Radio/ Mp4 . 10 loa Harman Kardon cao cấp. Cửa sổ trời Panonama . Sạc không dây chuẩn , Cruise Control , C...","Apple CarPlay, Cửa sổ trời, Cruise Control",Hybrid 1.6 L,229,315 Nm,8.7L/100km,4600 x 1800 x 1450 mm,1462 kg
6443410,Hyundai i20 1.4 AT 2011,Hyundai,2011,268000000,5,Số tự động,Xăng,https://s.bonbanh.com/uploads/users/151676/car/6443410/m_1758532221.465.jpg,"Hàng tuyển : -Hyundai i20 sản xuất 2011 máy 1.4L số tự động,màu đỏ rất thu hút,rất cá tính -Xe gia đình rất ít đi (chủ yếu trùm mền) -ODO mới đi 50.000 km (năm mươi ngàn km).Sai e xin tặng xe a/c dùng chơi -Lốp dự phòng chưa dùng -Chất xe như xe mới.Dám khẳng định ko có đối thủ -Phom xe rất đẹp,thiế...","Cửa sổ trời, Kết nối Bluetooth, Màn hình Android",Xăng 1.4 L,122,147 Nm,9.0L/100km,4600 x 1800 x 1450 mm,1439 kg
6571623,Hyundai Accent Đặc biệt 1.5 AT 2025,Hyundai,2025,482000000,5,Số tự động,Xăng,https://s.bonbanh.com/uploads/users/112126/car/6571623/m_1765533582.506.jpg,"Giá xe Hyundai Accent Đặc Biệt. Tháng 12 giảm 100% thuế trước bạ ✓ Showroom tiêu chuẩn 3S tổng kho Hyundai Miền Bắc - uy tín tận tình trách nhiệm ✓ Hơn 20 năm kinh nghiệm trong ngành với hệ thống Hyundai lớn miền bắc ✓ Khuyến mại sàn da, thảm chân, bọc vô lăng, voucher 5tr, vv.... ✓ Cam kết ưu đãi t...","Lốp mới, Màn hình Android",Xăng 1.5 L,146,182 Nm,8.3L/100km,4600 x 1800 x 1450 mm,1462 kg
6574785,Hyundai Tucson 2.0 AT Đặc biệt 2025,Hyundai,2025,802000000,5,Số tự động,Xăng,https://s.bonbanh.com/uploads/users/112126/car/6574785/m_1765725226.815.jpg,"Giá xe Hyundai Tucson Tháng 12 giảm 100% thuế trước bạ ✓ Showroom tiêu chuẩn 3S tổng kho Hyundai Miền Bắc - uy tín tận tình trách nhiệm ✓ Hơn 20 năm kinh nghiệm trong ngành với hệ thống Hyundai lớn miền bắc ✓ Khuyến mại sàn da, thảm chân, bọc vô lăng, voucher 5tr, vv.... ✓ Cam kết ưu đãi tốt cho khá...","Lốp mới, Kết nối Bluetooth",Xăng 2.0 L,160,193 Nm,6.6L/100km,4600 x 1800 x 1450 mm,1591 kg
6572386,Hyundai Stargazer Tiêu chuẩn 1.5 AT 2025,Hyundai,2025,450000000,7,Số tự động,Xăng,https://s.bonbanh.com/uploads/users/112126/car/6572386/m_1765791980.432.jpg,"Giá xe Hyundai Stargazer. Tháng 12 giảm 100% thuế trước bạ ✓ Showroom tiêu chuẩn 3S tổng kho Hyundai Miền Bắc - uy tín tận tình trách nhiệm ✓ Hơn 20 năm kinh nghiệm trong ngành với hệ thống Hyundai lớn miền bắc ✓ Khuyến mại sàn da, thảm chân, bọc vô lăng, voucher 5tr, vv.... ✓ Cam kết ưu đãi tốt cho...","Kết nối Bluetooth, Màn hình Android",Xăng 1.5 L,145,171 Nm,6.3L/100km,4600 x 1800 x 1450 mm,1387 kg
6555821,Hyundai Custin Tiêu Chuẩn 1.5T 2023,Hyundai,2023,765000000,7,Số tự động,Xăng,https://s.bonbanh.com/uploads/users/574593/car/6555821/m_1764731099.184.jpg,"Hàng vừa cập bến, em bán: - Hyundai Custin 1.5T tiêu chuẩn 2023 màu trắng - Xe 4,8 vạn km, lốp theo xe, sơ cua chưa hạ - Chất xe nguyên bản máy số keo chỉ, check tét thoải mái - Đã lên cửa điện, đèn bi led gầm,..về sẵn sử dụng - Có bán trả góp, có đổi xe các loại - Thiện chí xem xe alo em hoặc zalo ...","Lốp mới, Màn hình Android",Xăng 1.5 L,117,149 Nm,7.6L/100km,4600 x 1800 x 1450 mm,1559 kg
6579575,Hyundai SantaFe MLX 2.2L 2007,Hyundai,2007,279000000,7,Số tự động,Dầu,https://s.bonbanh.com/uploads/users/551861/car/6579575/m_1765969929.814.jpg,Bán huyndai Santafe sx 2007 máy dầu máy ngon điều hoà mát vui lòng lh biết thêm thoing tin,"Lốp mới, Dán phim cách nhiệt",Dầu 2.2 L,177,219 Nm,6.0L/100km,4600 x 1800 x 1450 mm,1489 kg
6579889,Hyundai Tucson 2.0 ATH 2019,Hyundai,2019,625000000,5,Số tự động,Xăng,https://s.bonbanh.com/uploads/users/54736/car/6579889/m_1765984833.310.jpg,"Huyndai tucson 2.0 đặc biệt . Sx2019 chạy 5 vạn km cam kết - Xe cam kết không đâm đụng, không ngập nước, bao check hãng toàn quốc. - Hỗ trợ sang tên đổi chủ, thủ tục giấy tờ pháp lý rõ ràng. - Chế độ bảo hành hậu mãi, chăm sóc xe miễn phí sau khi mua","Kết nối Bluetooth, Màn hình Android",Xăng 2.0 L,168,192 Nm,5.6L/100km,4600 x 1800 x 1450 mm,1448 kg
6420872,Hyundai SantaFe Cao cấp 2.2L HTRAC 2022,Hyundai,2022,1118000000,7,Số tự động,Dầu,https://s.bonbanh.com/uploads/users/640881/car/6420872/m_1757302768.214.jpg,"#banxe #huyndaisantafe Dầu premium Sản xuất 2022 ODO 4.9 vạn km giá tham khảo hơn là em bán Anh chị tới sem xe trực tiếp có bớt ̂́ ̛ ̛̣ ̂ ̉ ̣ , ̣̂ ̛ ̛́ , ́ ̀ ̣̂ ̂́ ̂ ̉ , ̉ ̉ ̣ ̣ ́ ́ ̂̉ ̂ ̀ ̂̃ ̛̣ ̂ ̀ % ́ ̣ ̃ ̂́ ̂́ ̀ ̂ ̣ : & ̂̃ ̆ ̛̀ ̂ ̀ ̣̂","Kết nối Bluetooth, Dán phim cách nhiệt",Dầu 2.2 L,197,242 Nm,8.3L/100km,4600 x 1800 x 1450 mm,1471 kg
6553481,Hyundai Custin Đặc Biệt 1.5T 2023,Hyundai,2023,815000000,7,Số tự động,Xăng,https://s.bonbanh.com/uploads/users/686490/car/6553481/m_1764594985.820.jpg,"Hyundai Custin 1.5T Đặc Biệt 2023 Odo: 2V4 km Giao xe toàn quốc – hỗ trợ bank tối đa 70% Địa chỉ: 68 Đinh Núp, Cầu Giấy Cam kết chất lượng văn bản và hỗ trợ check/test xe.","Kết nối Bluetooth, Dán phim cách nhiệt",Xăng 1.5 L,135,170 Nm,5.9L/100km,4600 x 1800 x 1450 mm,1514 kg
6563193,Hyundai SantaFe Cao cấp 2.2L HTRAC 2022,Hyundai,2022,1135000000,7,Số tự động,Dầu,https://s.bonbanh.com/uploads/users/686490/car/6563193/m_1765110609.305.jpg,"Hyundai SantaFe 2.2D HTRAC Premium 2022 Odo 3,8 vạn km Xe đẹp, giữ gìn chuẩn – độ giàn âm thanh 85 triệu Giao xe toàn quốc – hỗ trợ bank tối đa 70% AUTO16 – 68 Đinh Núp, Cầu Giấy, Hà Nội Cam kết xe chuẩn – pháp lý minh bạch – hỗ trợ check/test toàn quốc","Lốp mới, Kết nối Bluetooth",Dầu 2.2 L,193,222 Nm,7.6L/100km,4600 x 1800 x 1450 mm,1393 kg
6519648,Hyundai Tucson 2.0 AT Đặc biệt 2022,Hyundai,2022,784000000,5,Số tự động,Xăng,https://s.bonbanh.com/uploads/users/516921/car/6519648/m_1762742015.830.jpg,"Tucson 2.0ATH bản Xăng Đặc Biệt. Cá nhân sử dụng mới đc 4v. Xe đẹp chuẩn, không lỗi lầm. Check tét thoải mái. Các bác quan tâm qua em chơi xem xe ak.","Lốp mới, Kết nối Bluetooth",Xăng 2.0 L,163,198 Nm,8.6L/100km,4600 x 1800 x 1450 mm,1513 kg
6576570,Hyundai SantaFe Cao cấp 2.2L HTRAC 2022,Hyundai,2022,1185000000,7,Số tự động,Dầu,https://s.bonbanh.com/uploads/users/656145/car/6576570/m_1765815154.887.jpg,"Huyndai Santafe 2.2D Premium sx 2022 Đăng Kí tên tư nhân 1 chủ từ mới , biển HN xe chạy hơn 3vạnkm Full lịch sử bảo dưỡng hãng đến T3/2025 xe không 1 lỗi nhỏ , xe đẹp xuất sắc . Cam kết tất chào có thương lượng ACE nhé - Cam kết chất lượng bằng văn bản -Check test mọi nơi theo yêu cầu","Lốp mới, Màn hình Android",Dầu 2.2 L,183,214 Nm,8.5L/100km,4600 x 1800 x 1450 mm,1562 kg
6573468,Hyundai Tucson 1.6 AT Turbo 2019,Hyundai,2019,675000000,5,Số tự động,Xăng,https://s.bonbanh.com/uploads/users/656145/car/6573468/m_1765636663.610.jpg,Huyndai Tucson 1.6Turbo sx 2019 fom 2020 Tên tư nhân chính chủ xe chạy hơn 8vạnkm Full bảo dưỡng cực đẹp không 1 lỗi nhỏ Có thương lượng ACE nhé,"Lốp mới, Màn hình Android",Xăng 1.6 L,149,168 Nm,5.8L/100km,4600 x 1800 x 1450 mm,1470 kg
6579227,Hyundai Accent 1.4 AT 2023,Hyundai,2023,425000000,5,Số tự động,Xăng,https://s.bonbanh.com/uploads/users/617767/car/6579227/m_1765958941.568.jpg,"Bán Gấp Hyundai Accent 1.4AT Tiêu Chuẩn 2023 - Trắng Ngọc Trinh, Nội thất ĐỘC ĐÁO, Giá Cực Tốt! Em cần bán nhanh chiếc sedan quốc dân Hyundai Accent 1.4AT Bản Tiêu Chuẩn đời 2023. Thông tin xe: Sản xuất: 2023 (Đời cực mới). Phiên bản: 1.4 AT Tiêu Chuâ...","Lốp mới, Màn hình Android",Xăng 1.4 L,137,169 Nm,9.2L/100km,4600 x 1800 x 1450 mm,1524 kg
6076829,Hyundai Palisade Exclusive 2.2 AT 2025,Hyundai,2025,1260000000,6,Số tự động,Dầu,https://s.bonbanh.com/uploads/users/402996/car/6076829/m_1739243037.391.jpg,"Bên em xả kho Hyundai Palisade máy dầu cực kỳ tiết kiệm nhiên liệu. -Vận hành mạnh mẽ, linh hoạt -Chế độ bảo hành cực kỳ hấp dẫn từ Hyundai Thành công -CAM KẾT BẢO HÀNH 8 NĂM HOẶC 120.000KM -Xe này đã được xuất khẩu sang các thị trường nước ngoài, như Thái Lan Hỗ trợ trả góp 80--85% giá trị xe ra bả...","Lốp mới, Kết nối Bluetooth",Dầu 2.2 L,201,239 Nm,8.4L/100km,4600 x 1800 x 1450 mm,1417 kg
